risk_title,mitigation
Travel professional prepare forget film,Update documentation
Major represent bag,Increase buffer resources
Would important major Congress on be worker,Engage with client frequently
Summer law attention must become instead relationship,Implement automated testing
It always something know hope,Use standard frameworks
Born specific mother chair ago mouth,Conduct integration testing
Land compare above in after,Increase buffer resources
Establish central begin certainly fill structure,Conduct regular code reviews
Television cell imagine them,Update documentation
Most hot well simply leg small course interview,Enforce security best practices
Pressure investment fast tell,Conduct integration testing
Camera memory its operation air,Engage with client frequently
Song sit any garden able hot another,Implement automated testing
Perform admit environmental country movement,Engage with client frequently
Name shake respond side plan pay focus,Conduct regular code reviews
Along run use eat front south chair,Conduct regular code reviews
Somebody unit manage statement teach,Enforce security best practices
Floor information reality significant shoulder talk particular,Use standard frameworks
Because nearly successful admit center fund song,Conduct regular code reviews
Whether term claim most spend,Use containerization
Person strong number enter ability,Engage with client frequently
Term civil behind draw indicate everyone,Conduct integration testing
Worker improve born control,Use containerization
Choice trouble contain deep reduce though,Engage with client frequently
Doctor green tend scene lawyer,Increase buffer resources
Different think likely environmental finish weight,Increase buffer resources
Nice statement yet process animal body generation,Conduct regular code reviews
Form hit enough weight,Perform stress testing
Central career perhaps,Update documentation
Role describe which,Implement automated testing
Size bill front appear factor,Use containerization
Run wind writer door without movement,Implement automated testing
Common anything stage option environmental letter around kind,Conduct integration testing
Improve price well push wife wear,Update documentation
Thought onto specific news why community by,Increase buffer resources
Local discover surface discussion,Perform stress testing
Today note remain we professional,Increase buffer resources
Rise argue court certainly class food democratic,Update documentation
Large buy style experience,Implement automated testing
Already least can fall must group,Use containerization
Rest reveal eye trade,Implement automated testing
Goal debate analysis investment billion develop boy such,Conduct regular code reviews
Body add expect join offer,Use standard frameworks
Paper analysis very top easy,Perform stress testing
Recent night list real,Enforce security best practices
Certain feel foot might explain,Implement automated testing
Tough admit friend least film boy,Use containerization
Wear these through election structure Republican nation health,Increase buffer resources
Small onto yourself also read,Update documentation
Trial risk case source management measure these,Enforce security best practices
Better now get leave east bring kid,Conduct integration testing
Dream ask relate place represent discover,Implement automated testing
Discuss education care affect song risk,Conduct regular code reviews
Well friend way threat general,Engage with client frequently
Today if north,Use containerization
Red protect because to,Use containerization
None along no wide,Update documentation
Word old learn,Perform stress testing
Community series one else son collection site,Use containerization
Professional life heavy national beat business,Increase buffer resources
Candidate sea race or,Engage with client frequently
Beat follow floor consumer throw front return dinner,Use standard frameworks
Specific high though all sea popular rich,Conduct regular code reviews
Back measure fact street,Use containerization
Get foreign manager turn,Engage with client frequently
Manage forward no policy,Perform stress testing
Stage window reality middle floor,Perform stress testing
Degree interest anyone final education,Conduct regular code reviews
Dark else end five,Use standard frameworks
Hair impact may threat,Conduct integration testing
Best task thus message control seven,Engage with client frequently
Measure gun painting page space source,Implement automated testing
Owner improve yourself help,Perform stress testing
Safe oil the appear develop,Conduct regular code reviews
Ground support quality simply section Congress light,Use containerization
Western staff free sometimes probably magazine family,Use containerization
Very single one vote lawyer,Perform stress testing
Job group drug whatever property bill him,Increase buffer resources
Term ever upon successful vote decision often onto,Implement automated testing
Reveal choice deal at loss product whom,Conduct integration testing
Might assume movie simply toward whether wind,Use containerization
Government agreement financial fall cup else skill,Use containerization
Trip issue apply home data own now,Use containerization
Space finish exactly hundred,Update documentation
Machine everything top owner traditional,Implement automated testing
For list opportunity common buy,Enforce security best practices
Subject tough last,Engage with client frequently
As imagine evidence article,Engage with client frequently
Heavy so around painting,Implement automated testing
Hope start interesting trial,Use standard frameworks
Successful professional southern husband parent,Implement automated testing
Prepare character control produce exist interest,Perform stress testing
Which myself station,Conduct regular code reviews
Notice five law take yes full,Update documentation
Through here camera information hospital he,Use containerization
Push action practice,Implement automated testing
Choice energy world agent determine point,Use containerization
Ok table report best use billion,Increase buffer resources
Level certainly choice,Implement automated testing
Organization gas or because speak capital her,Use standard frameworks
Court whatever look pass order,Conduct regular code reviews
Character choose and color,Update documentation
Behavior rise game hand language vote dinner it,Use standard frameworks
Listen adult color stuff,Perform stress testing
For enough movement bar individual game,Engage with client frequently
Movement whole eat allow apply,Engage with client frequently
Human most room activity,Use containerization
Future walk smile decade into statement,Use standard frameworks
Network decision drive rule the,Increase buffer resources
Sister speech hold,Conduct regular code reviews
Actually rock politics,Conduct integration testing
Short entire deep table free,Perform stress testing
Fast long support author yourself wear leave different,Increase buffer resources
Size tell water business nearly school director,Update documentation
Own role decide,Update documentation
Assume none education decide economic mother,Engage with client frequently
Senior imagine life between personal eight,Use standard frameworks
Play then about work dog,Conduct integration testing
Skill compare particularly old bank use build,Conduct integration testing
Ground game myself resource lose ground,Enforce security best practices
Entire morning girl as market,Update documentation
Great particularly Congress energy,Implement automated testing
Kind away over guy view force hundred computer,Engage with client frequently
Player anyone reveal involve,Increase buffer resources
Improve mention today main daughter,Perform stress testing
Also assume industry,Use standard frameworks
Early knowledge science ground memory employee,Engage with client frequently
Product authority government prevent information better,Conduct integration testing
Every accept live situation,Update documentation
Worker by family compare final,Increase buffer resources
Mr industry news concern exist road,Update documentation
Keep detail husband,Increase buffer resources
Cup other four find east enough appear,Conduct integration testing
Truth loss himself rate assume example father dinner,Use containerization
Certainly manager protect financial strong board newspaper,Update documentation
Eight report open send high support point foot,Enforce security best practices
Body likely recent remember,Conduct integration testing
Road which personal really radio,Engage with client frequently
Ever onto sea which usually whether,Implement automated testing
Edge point clear front reason operation,Implement automated testing
Front their card,Use containerization
Hear above again wide,Implement automated testing
Tonight make rest however may plant weight,Increase buffer resources
Window arm during area,Use containerization
Name officer piece purpose able leader effort cover,Use standard frameworks
Guess gas fund method,Perform stress testing
Traditional build defense building,Implement automated testing
Two give various institution sport,Use standard frameworks
Thousand right career,Conduct integration testing
Either remember glass particularly difficult stuff child,Conduct integration testing
Although data former law body top,Update documentation
So brother carry fish risk,Implement automated testing
Assume so turn which statement food seek,Conduct regular code reviews
Physical back best question beautiful ahead later,Perform stress testing
Stop total tree recognize,Use standard frameworks
Out national smile,Use standard frameworks
Citizen own attorney game fly one particular,Increase buffer resources
Success catch radio according wish light,Implement automated testing
Still never seat son Democrat woman suddenly,Conduct regular code reviews
Seven beyond commercial analysis respond behind,Use standard frameworks
Director rest speech sing sign place cut,Engage with client frequently
Responsibility ground relate citizen,Use containerization
Myself sit near could baby,Conduct integration testing
Medical glass card produce maybe learn,Perform stress testing
Character someone control series,Enforce security best practices
Glass list morning later avoid ok,Perform stress testing
Country including money dog ask boy resource,Engage with client frequently
Against hand too under window few,Use standard frameworks
Far peace well strategy,Engage with client frequently
Seek then worry,Update documentation
Full heart score cup at personal,Conduct integration testing
Material assume degree environmental your per they,Conduct integration testing
East its natural another successful camera,Use standard frameworks
People almost response world least officer through medical,Use containerization
Left sometimes receive into research series,Enforce security best practices
Stop must majority admit quite think,Increase buffer resources
Quickly tough way community goal list,Engage with client frequently
Send particular trouble none respond,Increase buffer resources
Either of seem level sense lose cup,Increase buffer resources
Movement lay week fight exactly newspaper,Use standard frameworks
Station black move decision bad,Use standard frameworks
Lose standard impact produce respond,Enforce security best practices
Work but spring six,Use standard frameworks
Our list maybe industry sport,Use containerization
Dark section throughout their,Use containerization
Never standard leader medical around truth,Update documentation
Magazine institution road find right,Use containerization
Political speak production kid task,Conduct integration testing
Save how way near,Engage with client frequently
Above step different or learn,Perform stress testing
Mrs how scene tell,Use containerization
Hear lead lose ever whole add best,Use standard frameworks
Color second be lay ten,Use standard frameworks
Able process grow go over mean test decide,Use containerization
Arrive similar itself class,Perform stress testing
Pay each stand contain treatment Democrat hotel according,Conduct integration testing
Trip part by everything civil doctor,Engage with client frequently
Pay along third available ahead economy,Perform stress testing
Large less scene news reach prevent prepare,Update documentation
Source attorney politics line water,Conduct integration testing
Certain some improve various population hard,Increase buffer resources
Meet huge newspaper still,Conduct regular code reviews
Throughout surface heavy check town ahead among,Update documentation
Might house great mission challenge,Increase buffer resources
Strong guess friend yourself after always budget,Enforce security best practices
General center down meet might get network,Conduct regular code reviews
Including sport development probably book apply,Perform stress testing
Business class level business need,Enforce security best practices
Power wear PM technology beyond,Update documentation
Simply before result people whatever focus,Conduct integration testing
Popular story garden accept herself point,Implement automated testing
Can do share reach worry surface follow use,Implement automated testing
Perform out professor population power try mind,Update documentation
Believe water news information summer back,Update documentation
Ten may song force line think,Increase buffer resources
Trial special deal nature throw,Perform stress testing
Sell throw brother win,Use standard frameworks
Thousand either parent truth,Enforce security best practices
Bag activity well rich leader star,Increase buffer resources
Number party lot we president bill,Update documentation
Other Congress amount particularly institution manager front everybody,Implement automated testing
Player east wind recent director heart strategy,Conduct regular code reviews
Others other action,Use standard frameworks
General floor scientist life economic local during standard,Update documentation
Consider fish attack executive get,Use containerization
These off assume scene recent,Perform stress testing
Read low all machine,Enforce security best practices
Particularly rock strong old best machine natural,Perform stress testing
Garden serve reflect skill baby,Conduct integration testing
Rest simple foreign,Enforce security best practices
Value phone kind marriage,Use containerization
Sea center subject explain conference,Conduct integration testing
Republican world red language still democratic,Enforce security best practices
Offer computer community authority remember,Enforce security best practices
For support exactly artist letter police subject,Implement automated testing
Upon those score direction reflect environment,Increase buffer resources
Paper hundred put large be important,Perform stress testing
It put control positive discussion stay simply above,Implement automated testing
Front tell hair thought weight like heart,Perform stress testing
Believe current of weight,Use containerization
White meeting probably suddenly memory,Enforce security best practices
Boy range law development likely director tree at,Use containerization
Everything foot successful whatever including quite customer value,Update documentation
About suffer turn find suggest,Enforce security best practices
However use step sure,Conduct regular code reviews
Reason include anyone he idea herself,Perform stress testing
Can scientist less choice establish,Conduct regular code reviews
Federal peace dog around,Update documentation
Than into development explain,Use standard frameworks
Bill culture discover professor,Use standard frameworks
Me age become program across piece impact,Implement automated testing
Available hold join government,Enforce security best practices
Issue price clear beyond sport hot anyone,Update documentation
Would on individual,Conduct integration testing
Eight official skill add consider low,Update documentation
Food go pressure left themselves popular,Conduct integration testing
Room ahead citizen consider thus,Enforce security best practices
Range later lay table,Use standard frameworks
Catch support carry answer southern at,Engage with client frequently
Political foreign you why item network impact business,Conduct regular code reviews
Determine democratic bag,Implement automated testing
Manager life drug develop leg house discover,Conduct regular code reviews
Land improve plant our,Use standard frameworks
Call break he,Increase buffer resources
These popular develop foreign while quite matter worry,Perform stress testing
Loss conference defense either,Enforce security best practices
Yet past word number score she,Use containerization
Start want modern candidate after,Increase buffer resources
Very within whole thank off,Enforce security best practices
Same method seven machine least team material,Use standard frameworks
Put media back by,Enforce security best practices
Difficult employee factor hot nearly compare manage,Implement automated testing
Heart foot area near beyond build,Conduct regular code reviews
Air movement range same,Use containerization
Leader practice such,Conduct integration testing
Allow hair against onto sense rather,Perform stress testing
Apply region they want,Increase buffer resources
Week reason involve decide read fast detail institution,Perform stress testing
Move short easy look sell election,Use containerization
Maintain instead together nature watch will,Enforce security best practices
Deep responsibility base these research suddenly,Conduct integration testing
Away later base notice common threat single,Update documentation
Your method family fish,Engage with client frequently
South health loss significant risk size brother,Update documentation
Happen none spend top visit school establish health,Enforce security best practices
Show science than from her after agree,Use containerization
Price political your lead,Use containerization
Book knowledge garden that address event attorney gas,Implement automated testing
Hair work staff girl natural your cell,Perform stress testing
Another paper memory however anyone,Increase buffer resources
Life clear all whatever even student,Conduct regular code reviews
High middle our statement deal,Conduct regular code reviews
Radio man instead leave,Update documentation
Speak whether chair fine site during without,Engage with client frequently
Term region despite adult listen,Increase buffer resources
Feeling smile just even hear,Engage with client frequently
Notice series century since behavior leader,Implement automated testing
Happy speech claim,Increase buffer resources
Again list safe specific follow process sure,Use standard frameworks
Owner minute know serve today,Use containerization
Someone including candidate let not party movie,Use containerization
Challenge message third past it,Implement automated testing
Thus dream bag herself,Implement automated testing
Set contain election road,Perform stress testing
Fish increase than red,Implement automated testing
We feel what hard appear prove,Conduct integration testing
Measure impact throughout,Use standard frameworks
Skill voice field threat nearly at,Perform stress testing
Personal nearly system,Conduct regular code reviews
Board market later fire instead top discussion,Engage with client frequently
Laugh race bring,Engage with client frequently
Down list who according film financial key,Increase buffer resources
Floor arm his might agency,Perform stress testing
Film wonder painting bag price history become,Conduct regular code reviews
Anyone nor buy read politics until,Conduct integration testing
Red trial process tree environmental hold,Implement automated testing
Than represent or others meet what,Perform stress testing
Choice environmental main right history,Perform stress testing
Born tree sister history issue good color,Conduct regular code reviews
Thus loss should,Implement automated testing
Become material Mr represent parent bit threat,Update documentation
Investment black suggest fish,Implement automated testing
Resource practice man under claim there someone,Use containerization
Of guess spend policy bag tend they often,Conduct integration testing
Amount then apply,Engage with client frequently
Education meeting media international air cost rich natural,Enforce security best practices
Collection rise live laugh whatever explain,Use standard frameworks
Suggest choose religious alone security thought street yet,Engage with client frequently
Rule possible discover may animal fund along,Perform stress testing
Security soon candidate system up,Engage with client frequently
Subject style civil team tell involve nearly,Increase buffer resources
Management accept attention find,Use standard frameworks
Soon friend discuss whole political sea,Conduct integration testing
Pass house exactly course,Engage with client frequently
Meeting country machine human story some,Use containerization
Whom ask drug race charge more,Update documentation
Smile fine office marriage middle,Enforce security best practices
Item final structure yeah,Conduct integration testing
Fear your too outside hand difference,Enforce security best practices
Fast sometimes between realize direction various,Use standard frameworks
Space who material program,Implement automated testing
Well well office administration difficult glass important,Update documentation
Else word shoulder either state,Conduct integration testing
National spring gun chair finish much movement,Enforce security best practices
Feel market choose develop simply change,Increase buffer resources
Just size member on,Use standard frameworks
Remain head manage spend him career that,Update documentation
Upon without share Mrs continue fear,Conduct regular code reviews
Traditional structure present various significant situation,Conduct integration testing
Effort end for him store alone produce,Use standard frameworks
Industry scientist may,Increase buffer resources
Sound law film region,Conduct integration testing
Couple set moment less,Use standard frameworks
Buy perform seven strategy growth lead rock ok,Enforce security best practices
Seek real interview,Perform stress testing
Similar system throw,Use standard frameworks
Full better into reason learn,Use containerization
Low treat voice force institution anything,Use containerization
Ten itself carry certainly,Use standard frameworks
Manage sport next project,Conduct regular code reviews
Return yourself sound focus,Increase buffer resources
Heavy news it water machine yourself,Perform stress testing
Run anything five which black,Perform stress testing
Need movie answer while,Conduct regular code reviews
Thank check campaign leg reveal,Engage with client frequently
Economic magazine drop throw general amount,Update documentation
Across discuss gas condition admit live yes against,Use standard frameworks
To quite character magazine add wish,Conduct regular code reviews
Pay according head figure,Use containerization
Both place suggest style air discussion,Implement automated testing
Wrong already situation year,Use standard frameworks
Conference manage door strong,Engage with client frequently
Hotel team follow majority maintain hold,Conduct regular code reviews
Us far particularly son mention,Conduct integration testing
Marriage fall ground economy,Enforce security best practices
Thus since dog might politics worker ever piece,Conduct integration testing
Power strategy floor within energy share south her,Conduct regular code reviews
Professor when work easy,Implement automated testing
Family politics indeed say add scientist happy,Update documentation
Red force human military hundred finish add hold,Update documentation
Natural see real name along,Enforce security best practices
Now play cell,Update documentation
Society trouble happen fish,Engage with client frequently
Responsibility list authority learn generation work black,Update documentation
Key character them road however article,Conduct regular code reviews
Especially physical group draw,Enforce security best practices
How stock recent still two,Conduct regular code reviews
Consumer seat glass,Update documentation
Instead without future red leg black group,Update documentation
Best culture age,Conduct integration testing
Pattern feel blood per thus develop,Use standard frameworks
Else mission event parent even,Conduct integration testing
Continue store growth kid into world join,Use standard frameworks
Else bad learn financial score image,Increase buffer resources
How really cultural political,Update documentation
Western most among,Update documentation
Reality firm carry determine yard quality,Conduct integration testing
Happy marriage prepare begin newspaper business,Conduct regular code reviews
Cost economy at foreign,Use containerization
Civil war edge both,Engage with client frequently
Population religious son environmental marriage,Update documentation
Itself measure relate book manage conference truth wait,Use containerization
True action conference data food,Conduct regular code reviews
Party image science civil politics,Increase buffer resources
Few best participant along quite land Republican,Engage with client frequently
Game low region establish,Conduct integration testing
Else never once police maybe win happen,Use standard frameworks
Detail simply ask song,Use containerization
Bar plant my back receive though single clear,Use containerization
Practice myself area which term special air,Engage with client frequently
Positive become director individual,Conduct integration testing
Affect herself conference oil,Use containerization
Cause road ground,Update documentation
Half win media fish event knowledge,Increase buffer resources
Have consumer increase save base change must,Conduct integration testing
Case always outside her large expert commercial realize,Implement automated testing
Performance environmental player,Implement automated testing
Our hospital note,Enforce security best practices
Democratic north pressure task should,Use standard frameworks
