risk_title,mitigation
Thousand site matter before television far order not,Engage with client frequently
Local dog measure kid,Conduct regular code reviews
Region discuss space dinner city discussion fact,Increase buffer resources
Smile dog interest series which,Use containerization
Station husband order join population rest way,Enforce security best practices
Argue into add behavior team away process,Perform stress testing
This commercial be spend,Implement automated testing
Personal picture far fill season eight manage,Perform stress testing
Without which everyone,Conduct regular code reviews
Sense guess economy table pass,Increase buffer resources
Positive as poor live task adult,Implement automated testing
Give memory central pressure generation,Update documentation
Recent pattern into value federal management try,Use standard frameworks
Doctor thing design research by,Use containerization
Indeed item deep teacher catch short community,Perform stress testing
Article magazine size season,Conduct regular code reviews
Majority within office today,Implement automated testing
Hair as stuff discover how term seven under,Increase buffer resources
Like player out value condition worry need,Use standard frameworks
What similar just challenge water political least,Enforce security best practices
Somebody record shake current tough usually culture,Engage with client frequently
Throw ask because deal color style against,Engage with client frequently
Protect much can once send before,Implement automated testing
Own station there western responsibility step,Update documentation
Prepare quality public than former goal people,Conduct integration testing
Ahead nature probably collection name Democrat,Enforce security best practices
Owner admit wrong particular green compare meeting,Conduct integration testing
Mention ability later eye but little sport,Update documentation
Every happen resource skill air stuff beautiful choose,Use standard frameworks
Modern particular result place city own reality,Implement automated testing
Station or table take challenge save,Enforce security best practices
Middle water city rate worker treat director,Conduct integration testing
Left treatment model across always,Conduct regular code reviews
Listen third piece dog,Use standard frameworks
Can enough edge war maybe woman human,Engage with client frequently
Experience situation man enough fund threat,Use containerization
Else woman future,Engage with client frequently
National between member land agent painting PM energy,Conduct regular code reviews
Product common program cut state tough,Enforce security best practices
Born risk call share,Use standard frameworks
Walk same their,Use standard frameworks
General sense rather,Perform stress testing
Trial expert girl say,Update documentation
Might your stuff although language around,Conduct integration testing
Experience look goal rock,Increase buffer resources
Citizen section organization try bank apply enjoy always,Perform stress testing
Class high and under such,Implement automated testing
Let none leader forward environment within teacher,Enforce security best practices
Peace employee sport,Use standard frameworks
Bank plant matter thought great since bed,Perform stress testing
Usually walk street memory,Enforce security best practices
Social question specific because,Engage with client frequently
Attorney understand inside rule whole threat,Perform stress testing
Draw on any girl mission surface,Conduct integration testing
Provide age series fund quite somebody then,Use standard frameworks
Actually moment beyond,Perform stress testing
Determine letter final task heavy over street,Use containerization
Remain national executive risk team,Increase buffer resources
On home her break,Conduct regular code reviews
Resource whom bed seven,Implement automated testing
Him tough speak good whether manage wide,Enforce security best practices
Current response for morning interview end,Update documentation
Cup foreign report president your first third,Conduct regular code reviews
Other anyone increase child parent most cold,Perform stress testing
Find ground house voice,Conduct regular code reviews
Country around a thousand several next,Use standard frameworks
Deep third until woman wall,Increase buffer resources
Conference quite political,Conduct integration testing
Ago senior future imagine suffer,Conduct integration testing
Family design evidence,Update documentation
Trial discussion protect center social she,Implement automated testing
Current defense to daughter,Enforce security best practices
People than western measure produce,Increase buffer resources
Politics among how gas specific scene,Perform stress testing
Expect speech can ball partner research,Engage with client frequently
Garden crime require onto however until side,Increase buffer resources
Those late western exist,Perform stress testing
Specific no big,Engage with client frequently
Writer spend either bring line outside,Perform stress testing
Figure trouble test wife,Use containerization
Back our describe occur along but,Use containerization
Sound on well,Increase buffer resources
Consumer up stage agent against decision six north,Implement automated testing
Four stuff worker,Conduct integration testing
Time standard cut set also,Use containerization
Tell around base item study really pull,Increase buffer resources
Lose without clear money us,Increase buffer resources
Community tend always,Use standard frameworks
Test three economic present,Update documentation
Today decide somebody common human allow generation,Update documentation
And story himself again history customer create card,Conduct integration testing
Other as official lose,Conduct regular code reviews
Eye power seat usually,Conduct integration testing
This to audience rest yeah girl worry,Engage with client frequently
Present pretty well main fast none,Enforce security best practices
Add itself sense,Use standard frameworks
Must late add,Increase buffer resources
Section week heavy,Enforce security best practices
Rest concern weight event relationship kid throughout,Perform stress testing
Again cell experience either,Engage with client frequently
Everyone especially may shoulder concern,Conduct integration testing
Raise tree information structure democratic type,Conduct regular code reviews
Party memory quite,Use standard frameworks
The whom former military woman practice,Enforce security best practices
Something grow adult establish option,Engage with client frequently
General head hot play popular material,Perform stress testing
Large must everything,Implement automated testing
Fund development late however kid light,Implement automated testing
Take strong again travel tax outside,Enforce security best practices
Campaign allow natural decide skin,Use containerization
Hospital event down single,Use containerization
Away local her either,Conduct regular code reviews
Side treatment contain yes husband campaign,Conduct regular code reviews
Become entire central positive,Use containerization
Anything them writer thought mother,Implement automated testing
Think prevent health itself help,Use standard frameworks
Officer available include nice else visit half,Use containerization
Modern indicate avoid maybe,Increase buffer resources
Probably military great choice rock evening believe,Implement automated testing
Reflect leave everything help,Perform stress testing
Program choose man item or standard,Use containerization
Rate artist possible base ok,Update documentation
Create movement article state we bad,Enforce security best practices
Away base site interest,Enforce security best practices
Occur development partner especially,Engage with client frequently
Along bad suffer general sport difference Democrat,Increase buffer resources
Card everything skill feel issue,Use standard frameworks
Well home left beyond add peace,Enforce security best practices
Free after day specific whether senior young billion,Increase buffer resources
Pm assume play,Update documentation
Lead part quality door he opportunity poor,Increase buffer resources
Meeting outside political tell analysis anything,Increase buffer resources
Property quite including vote audience parent international,Implement automated testing
Life space surface raise,Conduct integration testing
Wall too five girl,Conduct regular code reviews
Six structure ahead compare hold hard charge,Conduct integration testing
Nation black pick hit according chair,Use containerization
Wish but threat player participant,Use standard frameworks
Class assume technology consumer identify ten card,Conduct regular code reviews
Expect mouth attorney,Implement automated testing
Language born smile visit me,Perform stress testing
Pay hit other suddenly perform,Use containerization
Condition me during cause,Increase buffer resources
Challenge outside well want rock piece,Enforce security best practices
Actually care degree choose north whether few,Implement automated testing
Bag very camera than charge international would turn,Increase buffer resources
Usually suffer heart,Conduct integration testing
Physical area effect,Update documentation
Game baby standard note class main,Enforce security best practices
Mention hair across situation from history in,Enforce security best practices
Specific low student real blood night,Increase buffer resources
Such treatment into,Perform stress testing
Generation sound fire weight glass nor,Use standard frameworks
Claim back too worker amount base yard,Conduct integration testing
Arrive until inside base compare civil,Engage with client frequently
Night approach rest physical,Use standard frameworks
Sort hit no ten,Perform stress testing
Responsibility onto product news represent,Enforce security best practices
Animal hospital bad way base minute,Conduct integration testing
Your catch nor energy task or,Engage with client frequently
Me beyond dog start occur,Use containerization
Try center involve represent admit ever recent,Engage with client frequently
Nation establish occur service until,Update documentation
Financial light stop consider relationship shoulder,Enforce security best practices
Use difference across ready let,Perform stress testing
After move itself popular,Perform stress testing
Chair night industry under,Enforce security best practices
Say decide level page certain chance,Conduct regular code reviews
Necessary wide land situation reduce sometimes,Conduct regular code reviews
Control after per environment available,Update documentation
Indeed either I just,Conduct regular code reviews
Child rule film politics whether seek art,Update documentation
Result democratic seven trip place detail pick,Conduct integration testing
Rise serve during husband,Use containerization
Management once they really claim floor,Use containerization
And development court challenge PM place popular,Conduct regular code reviews
Care help if test,Increase buffer resources
Sport somebody ten,Perform stress testing
Keep card also tend father while despite,Increase buffer resources
Man kitchen appear with pass,Engage with client frequently
Place conference bar sometimes play friend,Update documentation
Hope everybody responsibility effort board bring,Engage with client frequently
Citizen nothing hour natural tax,Update documentation
Themselves head purpose happy standard,Implement automated testing
With law human crime hour,Engage with client frequently
Reason clearly by wind truth set,Use containerization
Various author the far student,Implement automated testing
Red nature herself black know necessary center,Conduct integration testing
Eat professor lead reach everybody stock,Use containerization
Opportunity box music project born today response chance,Conduct integration testing
Against wish its building structure federal,Implement automated testing
Someone everybody fire purpose green,Use standard frameworks
Might from significant others minute sort happy,Update documentation
That still agency many particular natural management,Increase buffer resources
Dinner third enter bank provide attention fear,Conduct regular code reviews
Play instead per goal threat appear,Update documentation
First might music drive there son pretty Mr,Update documentation
Other administration civil effect I itself set,Increase buffer resources
Word two wall process share outside,Engage with client frequently
Physical their know,Conduct regular code reviews
Discover manage moment side create require product,Use standard frameworks
Fish long probably,Conduct regular code reviews
Thus production call personal financial season sense,Use standard frameworks
Point figure step,Conduct integration testing
Strong amount give concern base various and,Implement automated testing
Their box resource artist trial vote a,Update documentation
Factor I miss answer ready church arm,Engage with client frequently
Health theory sense probably hear no know,Update documentation
Time shoulder eye clear,Use standard frameworks
Fear article administration toward executive,Implement automated testing
Later hotel whose bit expect,Conduct integration testing
Material beat remember style,Conduct integration testing
Test window public place subject lay another decision,Update documentation
Of training future,Conduct integration testing
Professor to idea election form easy,Implement automated testing
Hair research building,Update documentation
Lead lawyer term can or which citizen,Increase buffer resources
Hair very first less impact character,Use standard frameworks
Center watch seven money attorney red bed grow,Increase buffer resources
Tend wall painting move rate always board,Use containerization
Increase financial impact begin into draw,Update documentation
Discover ground notice whose arrive attention,Use containerization
Because idea especially know there receive body,Engage with client frequently
But bad deep,Perform stress testing
People interview low fact,Engage with client frequently
Person direction the,Use containerization
Per policy idea positive which,Perform stress testing
Policy lot set small there buy,Enforce security best practices
Hotel sometimes range training glass,Implement automated testing
Win fly Congress as claim ability,Engage with client frequently
Commercial executive public course,Conduct integration testing
That road employee purpose,Perform stress testing
Along seven exist behind force drop great,Conduct regular code reviews
Door PM notice expert around million wall,Conduct regular code reviews
Interview factor team sea road party,Implement automated testing
Every owner among develop toward tough even,Update documentation
Three baby national reduce,Conduct integration testing
Sure throughout audience staff huge within,Perform stress testing
Stage clear teach can type put,Increase buffer resources
Purpose here suggest old and home,Conduct integration testing
Imagine now one treat college describe kitchen,Engage with client frequently
Purpose popular about citizen thousand lead,Use standard frameworks
Time ok court middle amount act,Conduct integration testing
Necessary level sure none body position agency meet,Increase buffer resources
Front agency quality,Use standard frameworks
Ago miss heart identify simply memory rock,Use standard frameworks
Property during tonight picture stop,Use containerization
Might machine where worker movie themselves main,Conduct integration testing
Entire bring fear movement,Conduct regular code reviews
Various choice we rich night hospital,Enforce security best practices
Issue building yes lose,Use containerization
Table consumer word product become happen laugh,Enforce security best practices
We tonight chair ask nation others,Increase buffer resources
Car on home report me game book,Conduct regular code reviews
Bring account back president card,Conduct regular code reviews
Memory suffer consider above outside size,Use containerization
Again world sure few through two agreement out,Conduct regular code reviews
Rest oil glass even fine rate,Use standard frameworks
Ready when him right development require,Conduct regular code reviews
Perhaps local outside pay whole audience notice sometimes,Update documentation
Require without card coach choice garden those amount,Engage with client frequently
One something final born role common,Implement automated testing
They thought choose that suffer,Implement automated testing
Design teacher finally song,Implement automated testing
Out seek gun door continue project,Implement automated testing
These sort foreign what through,Implement automated testing
Wide town development general learn trouble,Conduct integration testing
Serious change them mother leader,Conduct integration testing
Need traditional everybody five continue,Engage with client frequently
Sell lead back understand voice big,Update documentation
Throughout cold data wall,Conduct integration testing
Office physical wonder,Implement automated testing
Wind remember yeah pretty,Perform stress testing
Moment occur line much dog,Update documentation
Pay job natural effort into head detail represent,Increase buffer resources
School now any yourself help wear yet,Engage with client frequently
Staff course develop,Engage with client frequently
Present far name our late wide huge term,Increase buffer resources
Couple fund federal prevent couple your system,Increase buffer resources
Black similar law network size star PM,Use standard frameworks
Number the situation effort page,Use containerization
Check attack arrive relate cup cup evening,Use standard frameworks
Buy news myself analysis surface spring bed recognize,Implement automated testing
Gas test choice performance turn purpose,Engage with client frequently
Wish condition could shoulder least break firm,Update documentation
Tell natural return bank peace,Implement automated testing
South attention respond today,Conduct regular code reviews
Office short response hundred prevent history,Use containerization
Tend base Mr,Perform stress testing
School class large those scene start,Use containerization
Become recent my a learn often life measure,Enforce security best practices
Fast each father especially sit well participant finish,Use containerization
Everything half air top just pattern heart,Implement automated testing
The expert suggest myself end onto,Use containerization
Themselves bill certain,Increase buffer resources
Political list upon interview moment nothing,Conduct integration testing
Deep sometimes read crime,Use standard frameworks
Parent result account present save piece despite,Perform stress testing
After establish discuss movie single,Engage with client frequently
The hospital themselves plant full several,Increase buffer resources
Network war nice campaign fear,Use standard frameworks
Return film little compare contain,Update documentation
Owner east fine property nothing computer,Enforce security best practices
Fund within only that,Implement automated testing
Move population grow,Enforce security best practices
Determine color exactly sense,Conduct regular code reviews
Plan hope sell benefit entire,Update documentation
Run close mention water,Engage with client frequently
Position production environmental woman respond almost town,Use containerization
Recently design director cover manager likely audience,Conduct integration testing
Skill health forget not,Perform stress testing
Skin radio on,Enforce security best practices
Agreement something agency apply develop foot,Conduct regular code reviews
Fine attention population operation common reduce,Implement automated testing
Imagine amount system,Use containerization
Production learn for road nothing the watch writer,Increase buffer resources
Mind laugh most example live mission leader,Use containerization
Couple keep or total country citizen fire control,Use containerization
Company than hard long system cause him project,Conduct regular code reviews
Person several prove hair man science,Engage with client frequently
Require he support thank,Perform stress testing
Say range drop late throw,Implement automated testing
Six bill father stock poor stand skill,Increase buffer resources
Man each PM require range visit,Update documentation
Fill name arrive meeting,Implement automated testing
Maybe church range professor,Enforce security best practices
Rest all watch whatever south memory indeed,Implement automated testing
Operation city take amount education voice arm,Use standard frameworks
Between reach now should,Conduct regular code reviews
Pick finally since thank sure,Use standard frameworks
Collection less former number little sea,Conduct regular code reviews
Not director candidate art,Perform stress testing
Cold opportunity suffer brother black social,Increase buffer resources
Protect dark stage bill bring none,Enforce security best practices
Data fear include,Enforce security best practices
Investment college sound,Enforce security best practices
Break six fund soon into several pick,Use standard frameworks
Skill street present night development company particular capital,Perform stress testing
Position up because probably,Implement automated testing
Plan remain parent create,Implement automated testing
Politics foot car list know while,Implement automated testing
Site his heavy social through strategy member provide,Conduct integration testing
Draw receive lawyer system popular north,Perform stress testing
Mention hundred human water machine,Implement automated testing
Remember someone director guy common sort,Conduct regular code reviews
Reality sing move how,Enforce security best practices
Market yard hundred item eat from recently,Implement automated testing
Radio way question how card partner,Increase buffer resources
Say career production final miss,Conduct integration testing
Natural improve reduce business need yourself,Conduct regular code reviews
Total man rich early too paper,Use containerization
Stay news wear toward doctor eye,Use containerization
Reduce not front big then religious someone east,Increase buffer resources
Across energy nation and report nature,Conduct integration testing
Manager animal along hair three occur two,Increase buffer resources
Today these figure discussion society,Perform stress testing
Know pay feeling idea often,Conduct regular code reviews
Consumer artist simple finish,Enforce security best practices
Season performance tell by interest six rich,Conduct integration testing
Play wall ask stage direction view enjoy,Increase buffer resources
White system later,Use standard frameworks
Into speech trouble six direction,Implement automated testing
Phone way bed hear really according section,Increase buffer resources
Chair rule street difficult,Implement automated testing
Husband culture indicate,Conduct integration testing
So long I maintain decision rather discover,Implement automated testing
Tough ahead person his statement type six,Implement automated testing
Entire operation arm development everyone team street,Implement automated testing
Summer manager culture different summer front,Conduct integration testing
Push writer shoulder side,Conduct integration testing
Major toward family child door able amount,Engage with client frequently
Economic hospital allow similar well,Conduct regular code reviews
Guess able physical,Increase buffer resources
Address war fear interesting,Implement automated testing
Friend industry shake federal sound beautiful argue,Conduct regular code reviews
Car field help card test,Implement automated testing
Spend money own build necessary,Enforce security best practices
Fight give career next like ready,Enforce security best practices
Economic both stock buy note source few,Implement automated testing
National body same learn history throw,Enforce security best practices
Cause quickly base send as herself significant provide,Conduct integration testing
Order deep tough few what,Use standard frameworks
Apply number matter pull,Increase buffer resources
White adult moment join case,Use containerization
Recent off lawyer land already bit necessary say,Engage with client frequently
Situation law course seat,Use containerization
Owner employee chance city,Implement automated testing
Beyond make officer today media place,Use containerization
Never away change try letter,Update documentation
Four argue try where finally prove hit,Conduct regular code reviews
Leave prepare among,Engage with client frequently
Success eye more history eat issue,Use containerization
Sell natural think right series customer,Perform stress testing
Today teach young professor mean,Increase buffer resources
Strong live help,Increase buffer resources
Effect old boy hear catch project,Increase buffer resources
Yard friend soon value page cut movement listen,Perform stress testing
Week home development exist else,Conduct regular code reviews
Personal way high thousand class,Conduct integration testing
Rather happen throw focus group claim director rate,Use standard frameworks
Word field occur recently church off,Enforce security best practices
To series beyond your trip particularly,Conduct regular code reviews
Near myself room because her either difference,Increase buffer resources
Difficult relate issue party sit long trade approach,Conduct integration testing
Follow while according mind few,Use containerization
Poor include half according,Update documentation
Thank law conference beat probably most bank,Use containerization
Both raise task old change,Enforce security best practices
Your huge to add itself,Perform stress testing
Exactly simple art local couple that age,Implement automated testing
Deep decade ground factor,Use standard frameworks
Energy wind evening project or image degree stand,Increase buffer resources
During know beautiful herself throw attorney attorney,Conduct integration testing
Growth eat wide picture include process follow,Update documentation
Yourself local call character describe,Enforce security best practices
